PostId,"GROUP_CONCAT(Text SEPARATOR ' ')"
90530,"The class $\mathcal{R}^*$ of surfaces considered by Zelditch excludes all Zoll surfaces of revolution because of the ""simple length spectrum"" hypothesis (page 2) which is never satisfies for Zoll surfaces of revolution. For example it implies that the length $2L$ of ""meridian"" geodesics cannot be equal to the length of all other geodesics while in the Zoll case all geodesics have the same length. Thank you YangMills!!  I have copied your comment into a CW answer for acceptance."
90532,"Fermat should do this http://home.bway.net/lewis/
And I think Magma can too via either eliminating variables sequentially or possibly with EliminationIdeal. They have an online calculator if the problem is not too bulky. Junkie IMHO the question is about multivariate resultant rather than about how to eliminate variables in general. If you mean multivariate polynomial resultant then the best method is the Dixon Resultant (going back to Bezout).  There is an expository article here:

http://fordham.academia.edu/RobertLewis/Papers

This is for exact symbolic computation.  It probably won't work if there are more than say 10 equations."
90538,"Here's a random thought that occurred to me: wouldn't it make sense to consider spaces which are disjoint unions of simply-connected spaces? The content of homotopy theory should be essentially the same but maybe the category of such spaces would be better behaved (for one thing it has coproducts)? Sure but it doesn't have homotopy colimits: you can make a circle by gluing homotopically discrete spaces."
90540,"I don't have Fulton's book at hand so can you clarify: you are not happy with proving the statement about the number of columns and applying the involution? I think this is more or less how the original Schensted proof can be rephrased. Well... Yes to keep it simple let's say I'm just looking for a considerably shorter proof than the one in Schensted's paper. I had a feeling that since the statement about the number of columns can be proven so easily the same must hold for the number of rows in fact I was hoping for a similar argument.

Also I'm not quite sure what the involution statement is for SSYTs but that's probably due to my own ignorance. I am sorry for being unclear - apparently two statements got confused in my head. Alas the ""involution"" argument I thought of is in fact trickier than I hoped the correct statement is in this answer of Richard Stanley: http://mathoverflow.net/questions/14527/what-bijection-on-permutations-corresponds-under-rs-to-transpose/14543#14543 - but if you look the original pa"
90544,"I'm afraid I can't help with the question but out of curiosity are these monoids certain types of band? They are bands.  Can you do the Yoneda product of these Ext groups? The quiver presentation of the algebra in particular contains the information about products of $Ext^1$-groups."
90548,"Bischof although that paper is quite interesting I think you have misinterpreted the results.  What it says is that there is a right adjoint to the forgetful functor from Hopf algebras to algebras i.e. there is a cofree Hopf algebra on any algebra.  If $A$ is the algebra and $H(A)$ denotes the cofree Hopf algebra on $A$ then there is a natural algebra map from $H(A)$ to $A$ (corresponding through the adjunction to the identity map of $H(A)$) but this doesn't mean that $A$ itself can be given a Hopf structure. I don't sorry. You will notice however that in this paper the last statement is that the author doesn't know how to explicitly construct these Hopf algebras. You might try emailing the author and asking if any progress has been made. 
 You are both right I was being fast and loose in my comment. Sorry if I mislead you.  Actually I learned on MO a while back that EVERY algebra has a hopf structure! Here is the paper by Agore; http://arxiv.org/abs/0905.2613 Bischof that 's not quite true. You cannot turn $"
90551,"http://en.wikipedia.org/wiki/Lefschetz_principle#The_Lefschetz_principle There are some obvious statements not allowed in this principle--for instance ""the cardinality of every variety is at most that of the continuum"" (which is true over $\mathbb{C}$ but not over an algebraically closed field with cardinality greater than that of $\mathbb{C}$). Part of the interest in attempts to formalize the Lefschetz Principle are attempts to formulate exactly what statements should be allowed. Another comment is that while there exist formal versions of the Lefschetz Principle it is often used as a ""proof technique"" rather than a theorem to be quoted. For instance proofs can sometimes proceed in the following manner: 1) Show that the statement you care about can in any given case be reduced to a statement over a countable extension of $\mathbb{Q}$ by using the ""fact"" that the statement only involves countably many elements of your field. 2) Any countable extension of $\mathbb{Q}$ can be embedded in $\mathbb{C}$. Martin: "
90557,"The problem about eigenvalues of sums of Hermitian matrices was solved by Alexander Klyachko in ""Stable bundles representation theory and Hermitian operators"" Selecta Math. 4 (1998) no. 3 419-445. See also Fulton's survey article ""Eigenvalues invariant factors highest weights and Schubert calculus"" http://front.math.ucdavis.edu/9908.5012

 See http://mathoverflow.net/questions/31475/singular-values-of-matrix-sums  although your case is more special than this one."
90558,"Gerhard: well existence-proofs (a: varimin by enhanced iterated plane-rotations can be made to converge b: for 4n columns the variance of the squared entries is zero) would be enough to settle the question of existence of 4n-Hadamard-matrices. But if the answer of the convergence of varimin/varimax is not yet settled - how can we use the varimax-rotation as a standard procedure for factor analysis for more than 60 years research in psychology and social sciences? In the beginning of my enquiry I firmly expected there were some (simple) reference to some literature say Kaiser or Bargman... ... but now I'm really surprised that this does not seem to be the case. Alternatively I hoped a proof for the convergence might be not too difficult - so it might be inexistent because of ""triviality"" (The related proof for convergence of the (near related) principal components rotation seems to be existent though if I recall my older literature right) isn't the ""success"" of the algorithm also conditioned on the assumption "
90562,"There is also the earlier (1981) 'The File' on Ladd--Lipset survey 700+ pages. (I did not check in detail but just from the page count I guess it should be more detailed than what is on this subject in Challenges). Yes indeed. Thanks for pointing that out. I don't recall the details (I don't have copies of the books to hand) but the Ladd-Lipset-related documentation in ""Challenges"" is extracted from ""The File"".  I disagree with your evaluation of Lang's opinions.  But I agree that they should be available and I hope that his full archive is housed at some library somewhere +1.  Have you asked the Yale librarian? Thanks for the comment Theo. I have not asked the Yale librarian yet. While I am very familiar with the French system I do not have any idea as to how to get a copy of documentation held by a US university. (I know it may sound silly... Perhaps it is the easiest thing in the world... In France this is not.) That is one of the reasons why I am asking this question: understanding the procedure probably "
90563,"The composition of the structure map $X \to Spec k$ with any $k$-point $\Spec k \to X$ is an example of a non-bijective endomorphism. Sasha. You're right. I fixed it. Can't you use comparison theorems to reduce the problem to the lift of your curve over the Witt vectors and then in turn reduce the problem to the associated complex curve?  For a complex curve you can easily work out the associated action on the two Hodge groups (on the ""complexification"" of the cohomology). Ahh that's a good idea. So we reduce to the case of complex manifolds basically. Then we simply need to determine the action on $H^{01}$ and $H^{10}$. What is the general strategy for working out this action? (I'm not asking you to work out a concrete example. Just to give the idea if possible...) It is not true that endomorphisms are always automorphisms in positive characteristic. E.g. the Frobenius. you're right. they're all bijective though... Awhile ago I was wondering if I had an explicit equation for my plane curve and an explicit co"
90570,"Henry since Davis' examples Wall's conjecture reads as: Every $PD(n)$ group $G$ admitting a finite $K(G1)$ is the fundamental group of a closed aspherical $n$-manifold. There are ample reasons to believe that this conjecture holds for $n=3$ (e.g. via connection to Cannon's conjecture) and ample reasons to disbelieve for $n\ge 5$ (e.g. existence of ""exotic"" manifolds of Bryant-Ferry-Mio-Weinberger).  I have edited the question in asking only for homotopy equivalence. The following page provides some useful information:
http://www.map.him.uni-bonn.de/Aspherical_manifolds It all depends on your definition of a topological manifold. If you use the textbook definition then the result is: $G$ admits a manifold $K(G1)$ iff $G$ is countable and of finite cohomological dimension. Proof is a combination of a theorems by Eilenberg-Ganea Whitehead (Theorem 13 from ""Combinatorial Homotopy-I"") and Whitney's embedding theorem for locally finite CW complexes. However if you insist on your manifold being closed then you are f"
90577,"My guess is ""probably."" Here is the reference for $k\le 3$: http://www.ams.org/journals/proc/1996-124-08/S0002-9939-96-03755-0/S0002-9939-96-03755-0.pdf"
90580,"Crossposted here: http://stats.stackexchange.com/questions/24344/"
90581,"A normal form up to what equivalence relation? "
90583,"Ok thanks for these comments. I have read several proofs of the theorem in the ""classical case"" of co-algebras. Matthew Daws you point out what prevent me from adapting naively these proofs.  Can you give a bit more background?  What do you mean by ""algebraic quantum groups""?  What prevents the proof of that theorem from going through naively? van Daele uses multipliers-- so $A$ is a non-unital algebra and we have a non-degenerate homomorphism $\Delta:A\rightarrow M(A\otimes A)$ from $A$ into the multiplier algebra of $A\otimes A$.  Then you have to think what coassociative should mean and what the counit should do.  (Which are pretty obvious).  Often you want some sort of ""regularity"" condition.  It seems to me hard to generalise from the usual proof (of the stated theorem) as now you have multipliers everywhere.  But the question seems interesting if a touch vague."
90586,"Thanks Vladimir.  Gerhard ""Surpassed Daily Silly Question Quota"" Paseman 2012.03.08 I suspect the answer is yes for finitely generated A.  Do you know if that is so?  Gerhard ""Ask Me About. System Design"" Paseman  2012.03.08 Gerhard: finitely generated abelian groups are classified in a good undergraduate or basic postgraduate course and the answer ""yes"" trivially follows from the classification.  Henrik: to include some context to your question maybe it is worth mentioning that the property discussed is indeed the key ingredient of the simplest proof that the infinite direct product $\mathbb{Z}^\mathbb{N}$ is not free. (I learned it from http://reh.math.uni-duesseldorf.de/~schroeer/publications_pdf/infinite_product-1.pdf)"
90590,"fun trial with respect to what morphisms? Note that the group Von Neumann algebra construction is only functorial with respect to injective homomorphisms with closed range not all homomorphisms. I suspect that similar restrictions would be needed in the group-measure-space construction maudite autocorrect - first word should have been ""functorial"" The group-measure space construction should incorporate the group action in the definition of $u_g$."
90593,"....and those special cases are the ones where all cumulants of degree $3$ or higher are $0$.  If any cumulant of degree $\ge3$ is non-zero then infinitely many are non-zero.  However this question is about the set of values of $t\ge 0$ for which $t\kappa$ is a cumulant sequence. Can you include a link to the stackexchange question? Have you left a link there to the MO version? Done. ${{{{{}}}}}$ One condition mentioned on Wikipedia (the source of all truth) is that the cumulant generating function can't be a polynomial of degree greater than 2.  (The normal distribution manages degree 2.) So you can't have finite number of non-zero cumulants except in some special cases."
90597,"Do you wish to do this because strong convexity implies strict convexity? Or are you looking to see to what extent does the reverse direction hold? Suvrit I want to see to what extent strict convexity implies strong convexity around the minimizer. My final objective is to show positive definiteness of Hessian around the minimizer. Strong convexity $\Leftrightarrow$ positive definite Hessian and positive definite Hessian around minimizer is going to help me in convergence rate analysis."
90598,"I haven't tried to write the details down but it appears to me that you should be able to prove this using just the definition of the norm on $H^k$ the definition of a dual (operator) norm and maybe integration by parts."
90603,"Would you please remind what is length spectrum?  Dmitri: My understanding is that it is the multiset of the lengths of the closed geodesics: list all the lengths of those geodesics sort them and record how many times a length is repeated.  A variation is the *simple length spectrum* the multiset of the lengths of the simple closed geodesics. There seem to be various notions that go under the name ""length spectrum"". The simplest that I've also seen called the *length set* is simply the set of lengths of periodic geodesics. One may want to record multiplicities and then you get the multiset that Joseph mentioned in his remark. For my question I'd be quite happy to know if there are examples of non-isometric Riemannian metrics on the projective plane with the same length set.  If it is isospectral to the canonical metric then it is isometric."
90607,"I try to follow your advice: let $e_1 e_2 \ldots e_n$ be the standard base of the $\mathbb{Z}-$module $\mathbb{Z}^n$ for any $i \neq j$ we have that `$h_{ij} : \mathbb{Z}^n \to \mathbb{Z}^n : x \mapsto x + (x \cdot e_i) e_j$` is an isomorphism. For any $k \in \mathbb{Z}$ we definite `$S_k = \{x \in \mathbb{Z}^n : k \cdot x = 0\}$`. If $k = h_{ij}(k^\prime)$ then $k \cdot x = 0$ iff $k^\prime \cdot x = -(k^\prime \cdot e_i)(x \cdot e_j)$ iff $k^\prime \cdot x^\prime = 0$ where $x^\prime = h_{ji}(x)$ in conclusion $S_k \cong S_{k^\prime}$. Now as you said we can work like the euclidean algorithm and write $k = h_{i_1 j_1}(k_1)$ $k = h_{i_2 j_2}(k_2)$...$k = h_{i_u j_u}(k_u)$ where $k_u$ is one of $e_1 e_2 \ldots e_n$ and so $S_k \cong S_{k_u} \cong \mathbb{Z}^{n-1}$. It is OK? Yes and the proof imitates the euclidean algorithm. In elementary terms your question is: If $a_1$ $a_2$ ... $a_n$ are some integers which have no common divisors except $1$ and $-1$ prove that some $\mathbb Z$-linear combination of $a_1$"
90608,"The ${}_2F_1$ can be converted to a polynomial form (sometimes multiplied with ratios of gamma functions) for example if the function got transformed such that one of the first two arguements can be converted to 0. In order for your question to be more attractive to non-experts (this is of course not necessary) providing an explanation and maybe an example of what you mean by *converting to a polynomial* would be great. Mariano Suárez-Alvarez and Gerald Edgar : Thanks for your suggestions. I have just added more explanation. Polynomial in what?  ${}_2F_1\left(\frac{1-a}{2} -\frac{a}{2}; b;\frac{4z}{(1+z)^2} \right)$ is not a polynomial in $z$ in most cases."
90610,"Find in what sense? Numerically? Igor. It would be both in symbolic sense and in numerical sense but with symbolic sense preferred. "
90619,"For Q1 the topology is ""just"" the (canonical) topology on a countable product or coproduct of finite-dimensional topological vector spaces (""countable"" guarantees that the coproduct will be locally convex). Perhaps Chapter 2 of Taylor's notes would be helpful (http://www.math.utah.edu/~taylor/LCS.pdf)."
90621,"If you have two knots and two braids representing them knowing that they're the same braid is a sufficient condition for knowing that the two knots are the same but it's not necessary. The necessary condition was written down by Markov (http://en.wikipedia.org/wiki/Braid_theory#Closed_braids). "
90624,"To supplement Mariano's comment one could also demand that $\mathrm{Mod}(R_i) \to \mathrm{Mod}(R)$ defines a cover in the sense of Rosenberg's non-commutative algebraic geometry. Perhaps some properties are already mentioned in his work you should check it. I don't do much noncommutative stuff but it seems to me that an obvious replacement for covers is that the ""Cech complex"" `$0 \to R \to \bigoplus R[S_i^{-1}] \to \bigoplus R[S_i^{-1} S_j^{-1}] \to \bigoplus R[S_i^{-1} S_j^{-1} S_k^{-1}] \to \cdots$` be exact. A reasonable replacement for covers is that the product of your localizations be faithfully flat over $R$. This condition is quite useful."
90629,"Is $A$ a square matrix? If not do you have some condition on the number of rows of $A$? What is the $L_0$ norm? The number of nonzero components? This is not standard notation. Gerry $A$ is not a square matrix.  But it is very sparse. each row contains three non zero elements that are +1 or -1.   

Igor Yes i meant nonzero components. "
90635,"Could you explain why KL-divergence is not suitable in a bit more detail?  Your ""if and only if"" statement can't work if your ""divergence"" $f$ is a continuous function: every curve from a point where $f > 0$ to a point where $f < 0$ must intersect the set where $f = 0$. VSJ: KL-divergence would think that a $Y$ with a large variance was very different to $X$. I want something that penalizes variance.

Robert: Yes of course. I should have said something ""is zero if $X = Y$"". That is all I really wanted and I do want $f$ to be continuous."
90637,"This might be a good lead: http://arxiv.org/abs/math/0401382 by Chen and Griffin. In particular see Figure 3 on page 42. Wow there's a lot more on this topic than I expected - e.g. Peherstorfer Orthogonal and Extremal Polynomials on Several Intervals (1993 J. Comp. Appl. Math). No results concrete enough to use immediately but I'm surprised how much people have thought about it."
90638,"Do you want to prove it twice? Sorry I fixed it I believe that this is not true but I don't know an example off the top of my head.  "
90655,"Sure. For example if $V$ is any representation then $V^{\otimes n}$ is naturally a representation of $S_n$ (in fact this action commutes with that of $G$). But this question strikes me as a little broad. What do you actually want to know?  temp: well it depends on exactly how much structure you want to endow these categories of representations with. As an abelian category $\text{Rep}(G)$ (say over an algebraically closed field of characteristic $0$) is just $\text{Vect}^n$ where $n$ is the number of conjugacy classes of $n$.  Since every finite group embeds in some symmetric group it seems very doubtful that anything meaningful can be done to compare their representations (which I assume are taken in characteristic 0).   For instance all symmetric group representations are realizable over the rational numbers which is quite unusual for other finite groups. Qiaochu : I can't make this precise but I want to ask e.g. Can all Rep(G) appear by some construction and taking sub quotient from Rep(S_n)?"
90656,"There is a big difference between the finite-dimentional case and the other: in the latter manifolds are open subsets of the modeling space while in the former manifolds rarely are open sets of the modeling space (they embed in a euclidean space of a generally much larger dimension and even more rarely as open sets thereof) Usually the infinite dimensional objects one encounters in geometry are Fréchet manifolds (e.g. diffeomorphism groups or spaces of maps with the smooth topology) and these are really the objects of interest. Banach manifolds are a useful tool for *studying* infinite dimensions and actually proving anything because there you have the implicit function theorem. In particular if you have an elliptic problem e.g. holomorphic curves it's much easier to think of the solution space inside a Banach manifold of maps and then use elliptic regularity it prove it's really inside the smooth locus."
90660,"Have you looked at Curtis' notes on simplicial homotopy theory?  I think what you're looking for is in there.  I believe the notes appeared in Advances in the 70's. Another suggestion which is a comment not an answer because I don't really understand the material well enough to see if it *really* answers your question: Chapter 8 of Weibel's book on Homological Algebra. Although the main emphasis is on simplicial objects in abelian categories the remarks and exercises do develop some of the parallel theory for simplicial groups"
90661,"Sure. You introduce a new ""dimension"" to ""spread out"" things. This is also a common trick in algebraic K-theory. But others will explain this more properly ... By the way: 1+ for your question because in my opinion learning mathematics is not about verification of the proofs but rather to understand what the inventor had in mind and thereby understand the original idea (which often gets lost during the process of writing-up things unfortunately). The Rabinowitsch trick isn't a trick; it's localization. "
90664,"Well by the ""same"" in the p-adic setting I mean that the cup product is a map of Galois modules. Knowing this and the Galois module structure of $H^2_{et}(X_{\bar{K}}Q_p)$ gives restrictions on the Poincare duality pairing with respect to the Hodge-Tate decomposition of Faltings. (If you mean by ""orthogonality"" that the cup product of elements in distinct summands is zero then this is not true (but neither does this hold for the Hodge decomposition over $\mathbb{C}).) No even on the primitive cohomology the pairing is not orthogonal in the naive sense. What one gets is that the pairing of $H^{20}$ with itself is trivial similarly for $H^{02}$ the pairing on $H^{20} \otimes H^{02}$ is non-degenerate as is the pairing on $H^{11}$ with itself and $H^{11}$ is orthogonal to the other summands. This is also what happens in the $p$-adic setting. (Over $\mathbb{C}$ you can change the pairing to a Hermitian one using complex conjugation and this will be orthogonal in the usual sense but I don't think there is any $p$-"
90671,"We don't do Calculus here. Please see the faq - unless the question has some research interest it's better to ask it elsewhere. Is there a research angle? I'm not sure how trivial this is.  I suppose a first step would be to restrict the product to positive integers since that doesn't change the answer.  Guessing wildly you could try taking a log to turn it into a sum. Not calculus though. Looks like an exam question for a first serious analysis course. Indeed Charles. This can make a decent qualifier question too. The problem is that I don't know if Maria is an exam cheater or just a person who really needs this limit and cannot find it. So on scale from 0 to 1 where posting the full argument is 1 and telling nothing is 0 I'll tell the answer without the proof which is one half.    "
90673," Notice that $M$ is Haken ($T$ is obviously incompressible) maybe hierarchy of $M$ works to give a prove that it is impossible to find such an example... All you need is to observe what happens to rank of H^1 after this operation.  Misha  that is in some sense the first idea in my head. I just hope homology work to decrease the first Betti number under the surgery. But let us have a look at an example: mapping torus with monodromy map (21;11)---- we call this mfd $M$ $\beta_1(M)=1$. If we cut $M$ along the torus fiber we obtain $T^2\times I$ then glue two solid tori suitablely you can get $M_1 =S^1\times S^2$. $\beta_1(M_1)=\beta_1(M)=1$ ! Maybe you have another way to use homology...   I agree that $M$ must be Haken but $T$ need not be incompressible.  Consider the $S^2$ in $S^2\times S^1$ and then trivially increase the genus of this separating 2-sphere.  (I'm assuming that by ""nonseperable"" you mean simply non-separating.) Kevin Yes nonseperable =non-separating. "
90678,"Strict convexity plus smooth boundary is not enough for $\delta_D$ to be bounded. You also need that the curvature be strictly positive at those points where the tangent is vertical. I have modified the question."
90683,"When we reset the universe someone should remember to add a sixth fundamental force of interaction between particles in order to cause all expositions of Lie theory to be done with minimal hypotheses on the field. Mariano: I symphathize with your viewpoint (and should have been careful to add some notes to old expositions of my own) but in a short introductory course it's often better to stick to the most important framework such as working over a splitting field.    It's different if one is writing a comprehensive treatise intended for reference purposes.   "
