PostId,"GROUP_CONCAT(Text SEPARATOR ' ')"
88576,"Yes $F$ is self-similar exactly as Anton described.  Writing $F_{10} = \{x\in F \mid x_0=1 x_1=0\}$ and $F_0 = \{x\in F \mid x_0 = 0\}$ we have $F = F_{10} \cup F_0$.  Furthermore $F_0$ is a rescaling of $F$ with coefficient $\frac 13$ and $F_{10}$ is a rescaling of $F$ with coefficient $\frac 19$.  (This is just a fleshed-out version of Anton's comment.) The self-similar mappings are $F_{10} \to F$ $x\mapsto 9x - 6$ and $F_0 \to F$ $x\mapsto 3x$. Maybe I should clarify my follow up question: is $F$ in question a self-similar set? If so what are the self-similar mappings? Presumably the subscript $n$ on the last $x$ should be $n+1$.  Then at stage $n$ of the usual middle-thirds construction of the Cantor set when you have $2^n$ intervals of length $1/3^n$ each the number of those intervals that meet $F$ is the $n$-th Fibonacci number (if you index the Fibonacci numbers appropriately) which is asymptotically a constant time $\phi^n$ where $\phi$ is the golden ratio $(1+\sqrt 5)/2$.  So I'd expect the Hausdorff"
88581,"Vaughn thanks. The wikipedia reference is very much in the direction I was looking for. I also edited as you observed. 
 I guess you mean that $\theta$ can depend on $z$?  (Rather than on $\theta$.) Also your original rotation should be $f(z) = e^{i\theta} z$ and I assume that in your definition of a new map $f$ you want $f(z) = e^{i\theta(z)} z$. If I understand your definition then this is an incredibly large class of systems and there's essentially no hope of a complete answer.  Two remarks jump out:  (1) to talk about ergodicity you need an invariant measure.  A more meaningful question might be whether or not $f$ is *uniquely* ergodic.  (2) the maps you define are degree 1 maps of the circle.  If you put a few more restrictions on $z$ so that they must be homeomorphisms then there's a very rich theory of orientation preserving homeomorphisms of the circle. See http://en.wikipedia.org/wiki/Rotation_number for instance. Also http://en.wikipedia.org/wiki/Circle_map gives some idea of the richness of behavio"
88587,"Please see the FAQ for this site which suggests other places which might be more appropriate for your question."
88588,"Didier: The main reason is that MO is meant to be a resource of useful information. This question requests a big list of useless information... Also zero-insight proofs are not very hard to find. As Joel observed proofs by contradiction almost always provide no insight. this should be community wiki I rarely vote down a post but I did on this one. If I could I would also vote to close and delete... A related issue arises in  http://mathoverflow.net/questions/12342/reductio-ad-absurdum-or-the-contrapositive/12400#12400. François: Thanks for the explanation. Naively I thought that the question could be modified from asking for a list of examples (not very interesting) to asking for a description of the specific aspects if any exist of the results proved by so-called zero-insight proofs. Having said that since I cannot be more specific this is probably not a very productive idea. Anyway thanks again. François: A detailed explanation of the reasons why this question raises your wrath like it seemingly does woul"
88592,"Take your favorite wavelet basis for $L^2(\mathbb R)$.  You can construct a basis for $L^2[0\infty)$ using the procedure described in Daubechies ""Ten Lectures on Wavelets"" pages 334-335. WilliamDeMeo Thanks for the precise reference."
88598,"When I tried to right-click on the title (while in the list of recent questions) to open the question in a new tab I was only offered to be shown the TeX source of the formula (MathJax huh?) so maybe it is NOT a very good idea to have titles consisting of formulas only? I will fix it now hope you don't mind."
88601,"Ok here's a hint.  Why do you care whether the linear factors are real? Check the FAQ: this site is for mathematical research questions not for homework. hi angelo..i know that ....but i've been trying this problem for over a week..with no help whatsoever...this is NOT a homework problem...i know u guys are all hi-profile researchers and stuff.. but it wouldn't hurt much if you could just spill out a passing hint or show some light to me ..Plzzz! This site is not for this kind of question. The FAQ suggests other places you might try. MO is not for teaching assistance http://math.stackexchange.com/questions?sort=newest if you have a decomposition in complex linear fractions you can get a decomposition in real quadratic fractions just summing pairs of conjugate terms. Check http://en.wikipedia.org/wiki/Partial_fractions_in_integration "
88605,"Where did you come across the problem? See http://mathoverflow.net/faq#whatnot Well-known NP-complete problem. don't do it exactly search for ""approximate nearest neighbors"" ""locality sensitive hashing"" ""metric ball trees"" etc."
88608,"This chain condition is called ""dually slender"" and was already discussed on MO: http://mathoverflow.net/questions/59282/sums-compact-objects-f-g-objects-in-categories-of-modules . The counterexample mentioned my a-fortiori also appears there. Thanks! (I didn't look into that discussion when it was new and it didn't show up automatically when I posted this question.) It is exactly what I was after."
88609,"I am concern with the case when $\Sigma$ is a torus $S^1 \times S^1$. I edited the statement to this case. Thanks. I don't understand. Why do you introduce the action on homology? The mapping class group is not defined using homology."
88611,"Uday: The upper limit is $x$. Pietro: This was indeed inspired by the LU decomposition. I'm wondering how to construct the analogous functional form of the decomposition. So you want a continuous analog of the decomposition of matrices into lower and upper triangular matrices. I'm not a specialist but it seems to me that for reasonably nice kernels (e.g. Hilbert-Schmidt) the natural approach should be: pass to the limit in the decomposition for finite dimensional approximations and show that the sequence of factors admits a converging subsequence.   Pietro Majer: Matrixes can not be decomposed in a product of upper triangular and lower triangular matrices (look up Bruhat decomposition). You have to allow permutation matrices. But nice interpretation of the question. Is the upper limit of the inner integral $x$ or $u.$ ? "
88620,"My impression is that Iserles and his coauthors have worked extensively on this - have you tried looking up his papers? You also might want to check out this article: [Unitary integrators and applications to continuous orthonormalization techniques](http://www.jstor.org/pss/2158162) by Dieci Russell and van Vleck."
88624,"I have had three interesting answers until now (not being ruled out that there are others in the future) meanwhile I have thought to accept the one giving more details and more supporting references. Despite the apparent simplicity of the question I think this is a very good question for this site."
88630,"This is discussed for a general model category in my answer to this question and in the comments after my answer: http://mathoverflow.net/questions/86016/alternative-characterization-of-homotopy-equivalence/86032#86032

It is not true that weak equivalences satisfy the calculus of fractions in general but this does hold after you apply the homotopy relation. Another good resource is the nLab article. Unfortunately I don't know how to make $W$ admit a calculus of fractions itself before applying the homotopy relation. Indeed this is one of the main motivations for having a model category to begin with- to avoid the calculus of fractions and set-theoretic concerns. There is something called a ""three-arrow calculus"" which works in any model category.  This is formalized in the book by Dwyer Kan Hirschhorn & Smith (AMS monograph.)  This is perhaps not the kind of calculus of fractions you would like but is probably the best you can do for an arbitrary model category. The simplest description of the homotopy categ"
88632,"Even when $a = 1$ and $b = 0$ there is no simple closed form for this. There is however a sizable literature on the asymptotics of such expressions; see for instance the discussion of the Euler summation formula in Concrete Mathematics by Graham Knuth and Patashnik.  Hmmm MathWorld suggests that $a=1b=0$ simplifies to an expression involving the Euler-Mascheroni constant and the digamma function but I'm unsure whether the latter can be computed efficiently. (http://mathworld.wolfram.com/HarmonicSeries.html)"
88635,"Why post here? I think stackoverflow is the appropriate site. I thought this question was more generic than just software related."
88643,"For ring a power series it actually follows from Konstantin Ardakov's answer. By Bass' theorem if it is projective it is free but I'm not sure this helps much. Do you know the answer for rings of power series?"
88645,"You probably know that the answer is yes if you replace $\mathfrak{g}_{\geq 0}$ with $\mathfrak{g}_{\geq 1}$. This is actually true for any positively graded Lie algebra."
88648,"This question is not that well-defined. I mean for a supersingular elliptic curve the deformation space is non-canonically isomorphic to  the formal spectrum of $W[[t]]$. If the question is ""can this be given a group structure"" then the answer is ""sure -- it's the open unit disc"". If this question is ""can this be given a canonical group structure"" then my answer is ""can you define canonical?"". I have problems with the rest of the question for similar reasons. But let me try and say something a bit more helpful. In the ordinary case the universal deformation space has a canonical point... ...in it namely the canonical lift. In the supersingular case I find it very very hard to tell one lift from the other especially if the lifts are $W$-valued; I spent ages staring at such things once and found it really difficult to tell any of them apart. If there's a natural group structure on the deformation space then whatever could the origin be? I can't guess. So I am skeptical about there being any natural sort of grou"
88650,"This is very unique to the torus.  What you are interested in is the mapping class group of the surface which is quite complicated and an active area of research.  I recommend looking at the introduction of the book ""A primer on mapping class groups"" by Farb and Margalit available here : http://www.math.utah.edu/~margalit/primer/ This can be appropriately generalized for closed surfaces.  The Dehn-Nielsen-Baer theorem says $MCG(\Sigma)$ is isomorphic to $Out(\pi_1(\Sigma))$.  For the torus we simply get $\pi_1=H_1$ and $Aut=Out$."
88658,"nice observation florian; probably you can post it as an answer ?; what is the explicit matrix on terms of $abc$ ?
 How does this relate to what used to be called Serre's Conjecture which was settled by Quillen and Suslin and later by Vaserstein and Suslin? OP: You're working over a principal ideal domain aren't you? Whenever you have $(abc)\in \mathbb F_2[t]^{1\times 3}$ with $gcd(abc)=1$ you will be able to (explicitly) complete this to a matrix in $GL_3(\mathbb F_2[t])$ (which in this case is the same as $SL_3$). Imposing any further conditions seems unnecessary. The slides you link to do this for an arbitrary ring and only there does the problem become difficult."
88659,"If $a_n=1$ for all $n$ then the answer is trivially yes (a spiral for example). But if $a_n=2$ for all $n$ then I don't think it works. If you start at $(00)$ then you can only visit vertices $(xy)$ where both $x$ and $y$ are divisible by 2. I'm not sure about $a_n=n$. I think it's an interesting question. Indeed using a checkerboard coloring the parity of the step size must be odd infinitely often if the path is to take at most omega many steps.  One can likely use to different colorings to get mod p results and one can use arguments to show that exponential growth and perhaps even polynomial growth for cubic and higher polynomials also will skip some squares.  Gerhard ""Ask Me About System Design"" Paseman 2012.02.16 I am inclined to say yes for a_n  = n since given any two squares and any pattern generated by the first m steps with the first square reached on the m+1st step there is always a path to reach the second square which does not tread on any previous squares.  A formal proof of the last statement sh"
88660,"TThe set of prime ideals of _any_ field is the one-point space.  Good point. This gives some intuitive evidence for the fact that Hochester's construction can give a ring that is an algebra over any field (since every space is in some sense a module over the one-point space)."
88666,"If $a$ and $c$ are large enough compared to the other coefficients then the left side will be positive for all $xy$ so there will be no solutions. Pietro has shown that if you take the full set of equations (or even a small chunk) you get infinitely many solutions. Simple cardinality considerations show it's impossible to have an uncountable infinity of solutions even taking all the equations. I see no question at a research level here so I vote to close.  Could you tell me why is this interesting?"
88670,"Not a suitable question for a research forum"
88673,"It is my understanding that the ""independent of l"" conjectures are still quite wide open. Weizhe Zheng 
Sur l'indépendance de  en cohomologie l-adique sur les corps locaux 
Annales scientifiques de l'ENS 42 fascicule 2 (2009) 291-334 
is probably among the most advanced results there are."
88677,"Are you using the Fell topology on the unitary dual?  I am looking at representations on a fixed vector space $V=l_2(X)$ so I suppose we fix some natural topology on the set of all maps from $G$ to $U(V)$ (but any information with any topology is fine)."
88679,"How do you know this is true? It's not true so ""with difficulty"" is the answer to your question. One way to prove that $k$ is an eigenvalue is exhibit an eigenvector. A square (4 cycle) labelled 1 x 1 x with x=-1 shows that -2 is an eigenvalue."
88680,"Hi guoyi 
Do you mean that you want to close up a 3D manifold with boundary? It seems to be a question related to ""prescribing Ricci curvature"". Yes Chih-Wei I wonder whether any bounded part of noncompact 3D manifold with positive Ricci can be closed up to a compact 3D compact manifold with positive Ricci but its original metric is unchanged.
I did not find such example yet. It has application in Ricci flow of 3D manifolds. You're not assuming that the metric is complete? Otherwise this was resolved by Schoen-Yau:
http://www.ams.org/mathscinet-getitem?mr=645740 If the metric is not complete is not a spherical ball (as a domain of a bigger spherical ball) a counterexample? Any connected noncompact manifold admits a noncomplete metric with Ric>0 (a result of Gromov). So if you know a 3-manifold which is not homeomorphic to a domain in a spherical form then you are done. I should be more precise:
Can any bounded domain in 3-dim noncompact manifold with Rc> 0 be ISOMETRICALLY imbedded into a 3-dim compact manifo"
88683,"I really can't parse this question. I think the OP is trying to ask whether it is better to do classical dynamical systems of $N$ interacting particles instead of on $\mathbb{R}^{6N}$ where the position and momentum of each of the particles are specified but on something like $\mathbb{R}^{N(N-1)}$ where the relative distances and relative speeds of pairs of particles are specified. If that is the case the answer is probably ""no"" for sufficiently large number of particles: $N(N-1)$ is bigger than $6N if $N > 7$ so you have too many degrees of freedom and requires certain constraints (triangle inequality and what not).  Willie's right about my goal: I'm looking for the formula for an interdistance acceleration $d^{2}R_{12}/dt^{2}=f( \lbrace M_{i}R_{ij}dR_{ij}/dt \rbrace )$ for some number of point masses like eight. In principle my only solution is to first numerically embed these eight points into space and then to calculate this interdistance acceleration but I was hoping for an analytic method (which could a"
88684,"The complement of the Hopf link in $S^3$ is the same thing as the complement of the union of unit circle in the $x-y$ plane and the $z$-axis in ${\bf R}^3$. The stereographic projection $(xyz)\mapsto (2\cdot x2\cdot y 2\cdot zx^2+y^2+z^2-1)/(1+x^2+y^2+z^2)$ gives an explicit map $\mathbb R^3\to\mathbb S^3$. You could see what is the image of your thick torus. The coordinate lines of the natural parametrization become circle arcs... Have fun. "
88686,"Thank you all very much for your helpful comments. In the real case you need to change the definition of recurrence: there's 0 probability of ever hitting any specific point so you look instead at recurrence to a neighbourhood (i.e. a random walk is recurrent if for each initial point $x$ and for each $\epsilon > 0$ the walk almost surely returns to an $\epsilon$-neighbourhood of $x$. With this definition the results are the same as in the discrete case: the random walk is recurrent in 1 and 2 dimensions; and transient in 3 dimensions or higher. That was very helpful. Thank you very much. A related result is Rayleigh's theorem: start at the origin in the plane and make $n$ steps of length one with directions chosen independently and uniformly at each step. Then the probability of ending up at distance less than one from the origin is $1/(n+1)$. For an elegant recent proof by Bernardi see http://math.mit.edu/~bernardi/publications/Rayleigh.pdf.
 Look for some sources ... http://en.wikipedia.org/wiki/Random_wal"
88687,"There are algorithms but I know of nothing significantly faster than testing each candidate against n up to x.  Unfortunately the multiplicative property does not hold in a nice way for one to break down the problem and analyze it.  If you do find a nice estimate let me know; it will help me on a current project.  Gerhard ""Ask Me About Jacobsthal's Function"" Paseman 2012.02.16 Of course if you know phi(n) and just need a rough estimate a linear approximation works well for x much larger than n.  For x less than n that is interesting territory.  Gerhard ""Ask Me About System Design"" Paseman 2012.02.16"
88688,"(1) Why do you think additivity should hold?  and (2) Have you checked additivity for the disjoint union of two one-point spaces?    1) Well Hatcher (pag. 160) says that the reduced version of an homology theory should also satisfy the additivity axiom. Then reduced singular homology should do it right?  However your second question makes me think that additivity would imply that the (reduced) zeroth singular homology group for the disjoint union of two one-point spaces would be 0 wouldn't it? Then the complete version would equal 0+G (because of equivalence of reduced and complete homologies in dimension zero) while we know it is truly G+G (as the space has two arc components)... :(   Am I in trouble here?  I was confused because it appears you're using wedge sum (ie pointed spaces) rather than disjoint union (unpointed spaces).  Okay yes this kind of additivity holds.  In this case the reduced $H_0$ of a pointed space basically counts the number of path-components disjoint from the basepoint.  So if $n$ and"
88694,"Barinder: Thanks for adding more informations.  Mazur proves that if $N$ is prime and $>13$ then $X_0(N)(\mathbf{Q})$ is finite (Theorem 6). Right before Theorem 7 he says that one ""expects"" that if $N>163$ (""all $N$"") then $X_0(N)(\mathbf{Q})=\{0\infty\}$. The ""all $N$"" clause seems to indicate that he is including composite $N$ but for non-prime $N$ there are more than two cusps; maybe he just meant that there are only cusps. He refers to a paper of Ogg where the latter says that the then-known list up to $N=163$ ""may very well be a complete list"" of non-cusp points. Nowhere does he prove what you claim in the first sentence. Mazur does prove that if $N$ is any integer $\geq13$ then the only $\mathbf{Q}$-rational points on $X_1(N)$ are the cusps. Isn't the modular curve rational for some values of $N$? $X_0(N)$ are algebraic curves over rationals for all N.
 You might wish to look at Merel's paper (Bornes pour la torsion des courbes elliptiques sur les corps de nombres. 
*Invent. Math.* 124 (1996) no. 1-3 4"
88698,"I think the answer depends a lot on the acutal polytope. If this is formulated by $A\nabla u(x)\leq b$ then you should look closer on the set of $A\nabla u(x)\leq 0$. The polytope is described as $\{(p_1 \dotsp_d): 0\leq p_i\leq 1\sum p_i\leq k\}$ for some fixed k∈[0d]. It may be described in such a way for natural matrix $A$ with $2d+1$ rows. "
88710,"I had once the software ""graphpad prism"" for experiments with curve fitting. I found it very good for extremely explorative situations - it also tests parameter combinations of different types of functions out of a pool of functions which you can define. When I had it (~2 years ago) one could test the software for 30 days - that fitted well for the problem which I then have had. "
88714,"You are probably right - I just remembered seeing papers about orderable groups that mentioned several orderings of the free group and assumed it was a well understood topic. Any ordering of the free group gives a noncommutative monomial ordering. There is plenty of literature on orderings of the free group so that might be a good place to get started. I would be much obliged if you could be a little bit more precise than that and point me to some literature discussing this question. What I was able to find out so far were some papers where *right* orderings were discussed and some other papers discussing orderings of groups which are very far from free.  P.S. Of course I also saw some examples of orderings for the free groups but I don't think that I saw anything remotely similar to even a discussion of a question of classification. However I am sure there are things I overlooked and I would be happy to have a precise pointer (alas that ""plenty of literature"" you are referring to seems to be somewhat elusive"
88716,"GIve a set $X$ you have that $X\times \emptyset=\emptyset$ (may be you get a mistake considering $X\times \{*\}=X$ Please read a) the FAQ of mathoverflow b) any introduction to category theory. I've deleted the inappropriate tags (logic set-theory higher-category-theory). Thank you Martin ! Virtually every introduction to category theory will answer your question. In fact for two categories $\mathcal{A}$ $\mathcal{B}$ there is always a product category $\mathcal{A} \times \mathcal{B}$  and its definition is as straightforward as it can possibly be. Wikipedia and nLab also know the answer: en.wikipedia.org/wiki/Product_category ncatlab.org/nlab/show/product+category – Sebastian K. 0 secs ago"
88718,"Not only there are examples of sets of $(r-1)(d+1)$ points with no Tverberg partition but every set in sufficiently general position is such an example (by the dimension-counting). So every condition that lowers the bound in Tverberg's theorem must necessarily be of the form ""there is a particular kind of algebraic relation between the points"" which does not sound all that natural geometrically. With that said I do not know any results of this kind."
88730,"Tom Goodwillie: I added an example to explain better what I mean and to show that my questions are justified. The question is unclear. As I understand the terms a differentiable manifold has a unique smooth maximal atlas. The same topological manifold can have more than one differentiable structure that is is can be more than differentiable manifold that is it can be given more than one maximal smooth atlas (where ""smooth atlas"" means that any two charts in the atlas are compatible with each other and ""maximal"" means that every chart compatible with the atlas is in the atlas). Your $\mathcal A'$ should not be called a new atlas on the same differentiable manifold but rather a new atlas on the same topological manifold; or you can say that it makes a new differentiable manifold $M'$ with the same underlying topological manifold as $M$. Are you wondering when $M$ and $M'$ are diffeomorphic?  Of course they are in your class of examples ($f$ gives a diffeomorphism between $M$ and $M'$). Tom Goodwillie: Yes $M$ i"
88732,"I think this is somewhere in Kiran Kedlaya's recent book on $p$-adic differential equations. I don't have it nearby so I don't know for sure. Otherwise have a look at some of Laurent Berger's surveys. You might find something there.  Oh another thing you might want to give a (loose) definition of $\mathcal{E}$ because there are so many of ""Fontaine's rings"" (and not all by Fontaine); what's worse different notations for the same rings. (I assume you mean the ""Robba ring"" but I could be wrong.)"
88738,"Even though the log term will look ugly is it not more revealing to write the right hand side as 2y_i-1 - y_i-2 + log(1-stuff)/logp? Gerhard ""Ask Me About System Design"" Paseman 2012.02.17"
88740,"What about ""Algebre et théories galoisiennes"" of A. Douady and R. Douady (if you can read french)? McKean and Moll's book Elliptic Curves might be a bit elementary but I like their discussion of this a lot. Henri: that would have been my suggestion too. Douady and Douady is appealing to me but it's probably too sophisticated for my student - they define the field of meromorphic functions as a projective limit for example.  McKean and Moll is more the right style although I'm having trouble finding where they address the fact that I asked about. Simon Donaldson's new book ""Riemann Surfaces"" looks very nice if I could scare up a copy..."
