PostId,"GROUP_CONCAT(Text SEPARATOR ' ')"
91365,"If you want it for *every* $g$ you are out of luck because then the shift must be continuous in $L^p(w)$ which happens only if $w$ is essentially constant (the minimum is comparable to the maximum). Whops I should have said it more clearly... no for me $g$ is of a particular form. A usefull (for me) example could be $g=1/z$ (after identifying $\mathbb{R}^2$ with $\mathbb{C}$). An interesting class of weights $w>0$ for functions on $\mathbb R^n$ are the so called $v$-moderate weights that satisfy $w(x+y) \leq C v(x) w(y)$ for all $xy \in \mathbb R^n$ for some constant $C>0$. Here $v>0$ is another weight often chosen as submultiplicative. Then it follows from the unweighted Young's inequality that $L_w^p * L_v^1 \subseteq L_w^p$. For more on this have a look at
http://www.univie.ac.at/nuhag-php/bibtex/open_files/grXX_weights.pdf"
91371,"Very interesting question!"
91375,"Will isn't D1 more to the point than D7? We have (thanks to Noam Elkies) 3 4th powers that sum to a 4th power and (thanks to Lander and Parkin) 4 5th powers that sum to a 5th power. Guy says that for $k\ge6$ there is no known sum of $k$ $k$th powers giving a $k$th power.  Did your student ever turn in the paper on principal binary quadratic form plus monic cubic one-variable polynomial the sum representing all numbers? Gerry found it you are right.  I don't see why $G(k)$ is an upper bound for $n(k).$ Since every large $k$-th power is already a  $k$-th power I think they are irrelevant to the value of $G(k).$ Oh well. In Unsolved Problems in Number Theory by Richard K. Guy the closest thing is section D7 page 153 in my edition very specific your $x_j = j$ and $y = n+1$ Rufus Bowen conjectured no solutions. Does anyone know an all positive solution to $x^3 + y^3 + z^3 = t^3?$ I don't think $10^3 + 9^3 = 12^3 + 1^3$ counts. $3^3 + 4^3 + 5^3 = 6^3 \; \; \; 1^3 + 6^3 + 8^3 = 9^3 \; \; 3^3 + 10^3 + 18^3 = 19^3 \; "
91377,"Is there a Fourier transform in the category? I would guess that you would learn more by working out what the definitions mean in this simple case than by looking up answers. I don't agree with your definition of a categorified poset. I think this should rather be a $2$-category such that each hom-category is equivalent to the final category or empty (since a poset is a category such that each hom-set is a point or empty) or something similar. The process of categorification means that you ""climb up"" one abstraction level not just identifiying something below with something above. Martin I don't think he's using the word ""categorified"" in that sense -- he just means he's making or considering the poset a category. (-ify meaning generally ""to make"")  Martin Brandenburg: Maybe I misused the word ""categorification"": in the non-categorial mathematical literature a poset is a set (a 0-category) and the definition in my question is a 1-category: the elements become objects and the relations become arrows. It seems "
91379,"For a Gaussian the entropy is a constant times the log of the variance (or standard deviation) and contains no more or less information than that. It's only when you allow non-Gaussian distributions that the entropy becomes a more interesting information measure. One characterization of the Gaussian distribution (say of mean 0 and variance 1) is that among all distributions of given mean and variance it has the highest entropy.  So the Gaussian solves a maximum entropy problem.  But I suspect that's not the kind of thing you're after.  Could you clarify what you mean by ""of any use""?  "
91383,"Chuck: The transition to prime characteristic is an intriguing possibility in this setting though usually delicate.   It's probably worth asking Bram Broer himself to explain his remark.   And there is some further work beyond this paper which adapts some of Broer's arguments about normality to fields of good characteristic:  Jesper Funch Thomsen J. Algebra 227 (2000).    Thanks for the comments -- I'll ask Broer directly."
91385,"A superb exposition is contained in the first sections of Bott's ''Lectures on characteristic classes and foliations''.  Thank you Johannes"
91387,"With your hypotheses the subspace is an effective divisor if and only if the ideal sheaf is locally free of rank 1.  You can use Fitting ideals etc. to see that the locus where the ideal sheaf is not locally free of rank 1 is a closed analytic subspace et cetera."
91390,"The paper gives email addresses for each author. You could try contacting them"
91397,"What do you mean by ""Spectrum of a Laplace operator is a quadratic polynomial""?"
91403,"It depends on what you mean by ""discrete Gaussian distribution"". For example if $\sigma \ll 1$ the floor will be uniformly distributed between the values $0$ and $-1.$ Is that ""discrete gaussian""?"
91414,"Known special cases: Pietro Mongelli has a paper on the ArXiv which calculates parabolic K-Ls for Boolean elements and includes an answer to this question.  His paper extends an European J. Comb. paper by Marietti on parabolic K-Ls for Boolean elements for $S_n$.  (For $S_n$ Boolean elements are those Bruhat smaller than the longest transposition but the Coxeter generalization is not the obvious one.)  It is probably possible to use the Lascoux-Schutzenberger formula for ordinary K-Ls to extend Marietti's answer (at least for the question of being 0 or not) to all covexillary permutations. Jonah: As you observe the question seems quite difficult.   The answer might be of combinatorial interest but I wonder whether it would have any impact on the subjects in which these polynomials arise most naturally: representation theory and algebraic geometry.   (Deodhar's papers have had a lot of citations in those directions especially.)   Probably your question will have a reasonable answer mainly in very special cases"
91417,"Thank you Tara. Your approach gave me a wider perspective. However I wonder if there is a less-involved solution for this problem. If I could see the specific example you are looking at I might have more to say.  In complete generality I could only suggest the approach I would probably take.  (I don't know much about $\omega$-regular languages but in general I prefer working with automata to other representations of languages.) I think it's easy given a Büchi automaton to describe the finite prefixes of words accepted by the automaton.  So perhaps you could first find a Büchi automaton accepting your language?  (I think it's straightforward to do that from the $\omega$-regular expression.)"
91420,"Your question is ambiguous because $p_n$ is not uniquely determined.  Thank Felipe. Yes $p_n$ is not unique however I just call here $p_n$ for one of those. Dung Duong: I reworded your question to try to make it clearer. I hope that I haven't changed what you want to know. Try checking Ribenboim's book ""My Numbers My Friends"". It's very much a survey but if there's something to be said (i.e. if these are not open questions) it has the source. Your sequences are $A_0 = 0$ $A_1 = p-1$ and $A_n = (p+1)A_{n-1} - pA_{n-2}$ so covered by general linear recurrences."
91421,"I don't think Gross ever says anything non-trivial about reducible Galois representations in that paper. In fact it even surprises me that he proves (A) in the paper. Is the first line of the proof of (A) ""if the mod $p$ rep is reducible then just let $g$ be an appropriate Eisenstein series?"" [i.e. not even a cusp form]? Back in those days the assumption that the mod $p$ representation was irreducible was commonplace. I certainly don't know the answer to your questions by the way. It would surprise me a little if Gross' methods could say anything about the reducible case. Kevin: Thanks. Indeed in the first paragraph of the proof of Cor. 13.11 Gross says ""If $\rho_f$ is reducible [...] one can show using the theory of Eisenstein series that a form $h$ satisfying (2) also exists"" where (2) is the condition that describes a companion form and then briefly describes how to this in a particular case."
91423,"Nice spirals ! Regarding Q1 it will be probably hard to prove this is always the case given that it's unknown whether there are infinitely many Gaussian primes of the form $n+i$ with $n \in \mathbf{Z}$. So starting at $N+i$ and moving $+x$ we cannot exclude the possibility of hitting no prime. +1 for ""step on a plane"". Will you meet gaussian primes ? Is there something similar for Eisenstein primes? This plot shows some patterns: http://mathworld.wolfram.com/EisensteinPrime.html P-Y: Thanks corrected. Just a remark: The Gaussian primes on any given path are either entirely in $2\mathbb{Z}[i]+1$ or entirely in $2\mathbb{Z}[i]+i$. Hi Joseph! If you fix your closed cycle (the shape not the location) it would correspond to a fixed pattern of prime and composite Gaussian integers along that fixed path. Perhaps heuristics might give the conjectural asymptotics for the number of such cycles with that shape in a disk of radius $M$ centered at the origin. Typo on the first line (Guassian). (I don't have edit privilege"
91425,"By ""reduced"" they probably mean a word in the/a normal form (there are different normal forms for the Braid groups). Then the assertion is true see the survey linked by Igor.  Not knowing how they define ""reduced word"" or ""reduced form"" I can only suggest looking closely at those definitions. Usually those terms mean that the words have no cancellation which is equivalent to the words representing the same element in the free group and that is *not* the same as equality in the braid group. The title of this question is very vague.  A better title would be something like 'The word problem in braid groups'."
91429,"I confess that I've never seen this definition of a Chebyshev net before. Could someone provide a reference for me to look at? Deane  This appears in Chebyshev's lecture  28 Aug 1878 (Paris)  I did not see the original but there is Russian translation: http://www.mathnet.ru/php/archive.phtml?wshow=paper&jrnid=rm&paperid=7034&option_lang=rus
$$ $$
Later: Bakelman Chebyshev networks in manifolds of bounded curvature
$$ $$
it was reproved in 
S.L. Samelson & W.P. Dayawansa On the existance of global Tchebyshev nets.
The proof is based on Ladyzhenskaya Shubov Unique solvability of the Caushy problem...



 Anton many thanks!"
91434,"Hint: Doesn't the inequality you are trying to prove look very much like an inequality solutions to an ODE might solve...? There should indeed be a minus sign in the exponential. I suppose this is a little interesting since it involves the optimal constant in the Poincaré inequality. Don't use the formula for the solution. Just use the heat equation itself. Differentiate the integral of $u^2$. Indeed it should be a decaying exponential and with the optimal constant. And Noam is right that you can get the desired inequality from the explicit solution. All of the terms in the Fourier series except for the first one decay even faster and the first term decays exactly at exactly the rate given by the inequality. Deriving the inequality directly from the equation is a good approach because it generalizes to appropriate variable coefficient heat equations as well as higher dimensions. Is the upper bound really supposed to be an *increasing* function of $t$?  Anyway the Fourier expansion seems to give a sharp bound"
91436,"The main thing is that the equation must be a linear homogeneous elliptic PDE with sufficiently smooth coefficients. In spirit a solution to such an equation behaves analogously to a solution to the standard Laplace equation or the Cauchy-Riemann equations which are always real or complex analytic and therefore satisfy the unique continuation principle. But alvarezpaiva gives the right reference below."
91439,"I don't understand this question.  We have two different groups $H$ and $H'$ acting on the same set $S$.  What does it mean for these actions to ""coinicide""? Steven: $H$ may coincide with $H'$ even if $G\ne G'$. In general $H$ and $H'$ can act with kernels $N N'$ and the actions of $H/N$ and $H'/N'$ may coincide (i.e. these two permutation groups may be the same). 
 In fact the question asks for an algorithm of finding the intersection of two subgroups of $S_n$ (I assume the set to be finite). Each subgroup is given by generating permutations. I guess the problem is  
NP-hard (at least).  I couldnt understand why this question has a vote to close and then by accident my stubby finger hit to vote to close when I was checking the reason. Sorry. This is a good question.  I vote to undo my accidental vote.  Benjamin Steinberg:  The vote to close was mine for the reason given in my comment above.  I see now that the question is both meaningful and interesting though I continue to believe that the wording makes it "
91442,"For this question I would suggest instead for the title something like 'Background for classical forcing notions'"
91444,"You mean the Seifeit surface?"
91449,"Sorry I should probably have dug a bit deeper before posting my crie de coeur.  I found a reference to this paper by Deutsch http://www.sciencedirect.com/science/article/pii/S0012365X98003719 and the answer may be there."
91454,"Is $a_1 \neq 0$ the final goal or are you interested in necessary (and possible sufficient) conditions on the sequence $\{a_n\}$ for  
$$
f(\theta) := \sum a_n e^{in\theta}
$$
to be a Jordan curve? "
91456,"I guess that if you understand the finite case the compact case will be very similar. So let us suppose K finite. Here is a candidate : let S be any multiplicity one left-submodule of C(K) containing a copy of each simple left module. Then take $M=N:=S. C(K)^H$. 

I am much too lazy to check anything at the moment but I'm pretty sure it works for H=K or H=\{e\}$ !

On the other hand this is maybe not as nice a construction as what you would hope for. Thx. What is $S.C(K)^H$? Well the product of these two subsets of $C(K)$ or if you prefer the $(C(K)^H)^{opp}$ submodule of $C(K)$ for the right multiplcation that is spanned by S (which is a $C(K)$-submodule for the left multiplication). Argh I don't know how to edit the previous comment. I meant the product of these two subvectorspaces not subsets. I.e. linear combinations of products."
91457,"It seems to me that $R$ can be written as a tensor product of $S \in M_q$ and $T \in M_p$ given by
$$ S[x_0x_1] = 1 \Leftrightarrow x_0 + 1 \equiv x_1\ (mod\ p) $$
and
$$ T[y_0y_1] = 1 \Leftrightarrow y_0 + 1 \equiv y_1 \ (mod\ p) $$

I suspect that there is a typo and the condition on $S$ is supposed to be $y_0+1 \equiv y_1\ (mod\ q)$.
In any case this tensor product formulation may be helpful."
91462,"The error begins in line zero: Calculate without fixing a definition of $e^z$. That is not the problem $e^z=1+z+{1\over 2}z^2 +{1\over 6}z^3+\ldots$ is perfectly well-defined. The problem is not with defining $e^z$.  It's with defining $a^z$ for $a\neq e$. http://mathoverflow.net/faq#whatnot There does not seem to be any further need to edit this question.  Please let it be."
91469,"fedja  Thanks! No. You can easily design a Lip-$\alpha$ function such that the variation norm remains large when measured on arbitrarily fine partitions: $f(x)=\sum_{n=1}^\infty 10^{-\alpha n}cos(10^n x)$ is the classical example. However the variation norm of any Lipschitz functions tends to $0$ if you restrict the partition interval size.  "
91472,"Geoff well it tells you *what* has to be checked! :D It is a polynomial algebra exactly for the groups generated by pseudoreflections (this in particular tells you the precise representation) This is the full content of the C-S-T theorem.
 (See http://mathoverflow.net/questions/52457/finite-groups-generated-by-pseudo-reflections which is relevant here) I know the theorem you state as the fundamental theorem of symmetric functions. Chevalley-Shephard-Todd is a more general theorem.  Mariano: It's what was intended by the bracketed ""this in particular tells you the precise representation"" that was unclear to me. I'm glad this question was asked since recently I too was interested in the more general first part (for what other representations of $S_n$ are generators [and relations] known explicitly?).  Hope it gets answered! Mariano: This doesn't quite cover the question of whether $S_n$ acts as a reflection group is some other representation though and in fact the realisation of $S_6$ as a reflection group in a"
91485,"I am not sure what you mean by ""attacking the integral"" but you can certainly write the $n$-th power in the integrand as a Dirichlet series $F(s)=\sum c_m m^{-s}$ and then Perron's formula yields that $I(x)$ equals $\sum_{m\leq x}c_m$. More precisely for $x\in\mathbb{Z}$ the term $m=x$ gets weight $1/2$. well that IS the problem - more or less - the coefficients in the Dirichlet series $ c_{m} $ ..what form do they assume ? Well obviously $c_m=\sum_{m=m_1^{k_1}\dots m_n^{k_n}}(k_1\dots k_n)^{-1}$ where the sum is over all decompositions $m=m_1^{k_1}\dots m_n^{k_n}$ with $m_j\geq 2$ and $k_j\geq 1$. thanks for the prompt reply but in the literature i've seen a laurent expansion of
$$\sum_{k=1}^{\infty}\frac{\zeta(ks)-1}{k} $$
about 1 . i was hoping for a similar on for $$\left( \sum_{k=1}^{\infty}\frac{\zeta(ks)-1}{k}\right)^{n}$$ and do the integral without resorting to arithmetic functions as in your approach . unfortunately i wasn't able to obtain papers on the subject as they were behind a payment wall !! "
91487,"In case of $BB(2)$
i would just write down every possible two-state machine and show that they produce lower scores than 4. i thought so to but there are ( 2*2*(2+1) )^(2*2) = 20736 machines Well that was very silly of me then.
The article you're looking for is 

Lin Shen and Radó Tibor (1965) Computer Studies of Turing Machine Problems Journal of the ACM Vol. 12 No. 2 (April 1965) pp. 196–212. 

Sadly
I can't seem to find a download link.

Note moreover
that Wikipedia says that most of the proof for $BB(3) = 6$ was obtained by the aid of computers. yep that's the article i need.
Can't find a link also.
think this one can be solved without a computer - got it for homework :) For what is worth the article has no details of the computation of $BB(2)$ and instead concentrates on $BB(3)$. The notation they use is $\Sigma$ for $BB$. ""As an exercise in a seminar it has been shown that $\Sigma (2) = 4$."" It really can be done by hand actually in spite of the large number of Turing machines that seem involved. "
91488,"This isn't true.  For example a quadratic twist of an elliptic curve is a twist in your sense but not a torsor under the original elliptic curve.  Even worse a twist of $G$ in your sense need not be a torsor for any group whatsoever.  Here is a silly example: $G=\mathbf{Z}/5$ $X=\text{spec}(k\times k\times k')$ where $k'/k$ is a cubic separable extension. On page 98 of B. Poonen's notes www-math.mit.edu/~poonen/papers/Qpoints.pdf it clearly states that the set of $k$-torsors is equal to the set of twists of $\mathbf{G}$ where $\mathbf{G}$ is the algebraic group $G$ endowed with its  right action  of $G$ given by translation. Aren't the twists of $\mathbf{G}$ the same as the twists of $G$? He means twists of $\mathbf{G}$ as a $G$-torsor not twists of $G$ as a variety. Ow I see. Well then it's clear. Just a minor nitpick: the bijection between the set of $k$-twists and $H^1$ does not follow from the references he gives between parentheses...(That's what had me going.) You need the analogues of those ""statements"
91490,"I broadened my research and it appears it is equivalent to the end-to-end distribution function of polymers in the worm-like chain (WLC) model. An exact form for the PDF has been published in 2002 in ""The distribution function of a semiflexible polymer and random walks with constraints"" by Stepanow and Schutz in Europhysics Letters.

I'll look deeper into that paper and if it answers my question I'll close this question."
91491,"See for instance 
http://en.wikipedia.org/wiki/Steinhaus-JohnsonTrotter_algorithm. 
 Richard Stanley: Thanks! The link you gave was broken but it was enough for me to find [Wikipedia's page on the Steinhaus–Johnson–Trotter algorithm](http://en.wikipedia.org/wiki/Steinhaus%E2%80%93Johnson%E2%80%93Trotter_algorithm).  If you'd like to upgrade your comment to an answer I'd be happy to accept it. O.k. I will upgrade my comment. I am glad it helped. "
91493,"do you mean its symmetry group surjects a subgroup of this group? Otherwise I don't see why it couldn't have larger symmetry group (e.g. Hopf link has a T^2 subgroup of its symmetry group in S^3).  I edited to clarify these points. Thanks! you might also want to add ""non-split"" to the hypotheses to avoid the example of a split union of two copies of a reversible amphicheiral knot."
91496,"Isn't the infinite case much easier than the finite case (and in fact almost trivial)? Given two sets $AB$ of basis elements just write each element of $A$ in terms of finitely many elements in $B$ and since this spans we must use every element of $B$ somewhere so $B$ is a union of finite sets indexed by $A$ hence if they're both infinite $|B| \leq |A|$. Similarly $|A| \leq |B|$. 

Maybe when set theory wasn't well-developed this proof was less obvious but to me it seems likely that it's a sufficiently easy result it might not have been formally published but just remarked somewhere. The reference in Howard-Rubin points to L. Löwig who published a proof in this paper: matwbn.icm.edu.pl/ksiazki/sm/sm5/sm513.pdf. Also note that it already follows from the Boolean primer ideal theorem (or ultrafilter lemma) which is strictly weaker than the full axiom of choice godelian: The reference on Löwig's paper looks very good. Thank you very much.  Your question is about ""Cardinality of the basis ..."" or ""Size of the b"
91515,"This is not important but shouldn't be \prod_i instead of \sum_i? Yes it should be \prod_i. Sorry about that carelessness."
91520,"I think in your case for $R/I$ to be CM it is necessary that proj. dim $R/I\leq4$. Mahdi: how do you get $4$?
 A sufficient condition is that the quotient ring has the expected dimension. See

http://mathoverflow.net/questions/44823/irreducibility-smoothness-of-the-degeneracy-locus/45502#45502 the case that I'm more interested in is when I is of codimension 2."
91528,"Dear Ariel 
Welcome to MathOverflow! May the force be with you :) Wouldn't any two players in A have the same number of transfers and the same for B? I guess I don't understand the game. To Patrick: Note that the direction of transfer between any two players is indepedent from the directions in other ""matches"".  Thanks it's clearer now. So we could say that every pair of players in $A$ flip a fair coin and the winner gets $\$2$. Every pair of players with one from $A$ and one from $B$ flip a fair coin and the winner gets $\$1$. Interesting problem!"
91530,"When working with groups you are implicitly working in enough of second-order arithmetic to make the basics of model theory function. As such you have the categoricity theorem for $\mathbb{N}$. The lack of categoricity for first-order $PA$ occurs only because we cut back the assumption that $\mathbb{N}$ is well-ordered (since this is a second-order assumption.) What I'm really trying to say here is that non-standard elements only seem to creep in when you throw out the assumption that $\mathbb{N}$ is well-ordered. I believe that categoricity of $\mathbf N$ means that all copies of $\mathbf N$ look the same within the universe but not necessarily the same as the external standard $\mathbf N$?

Maybe the solution is that we work in second-order arithmetic in which all the finite sets (of integers) actually exist as opposed to set theory?  The key thing to note is that you only logically work in the formal theory of $PA$ which makes no mention of non-standard elements and can't distinguish between standard and n"
91531,"What is G? The absolute galois group of $\mathbb{Q}$? Yes. I was going to put that."
91546,"Community wiki I suppose? Yes. How do I do that? It would be good if someone is giving a ""counterexample"" that the correct result be mentioned and the missing hypothesis be pointed out. For instance with the non-isogenous elliptic curves having the same $L$-series it should be noted that over the *rationals* elliptic curves with the same $L$-series are isogenous.
Another possibility is abelian varieties with a finite Tate-Shafarevich group of nonsquare size; for ell. curves the size must be a square but in higher dimensions that is false. See http://mathoverflow.net/questions/9924/order-of-the-tate-shafarevich-group. This should be CW."
91550,"The maximal chain $0 \subset p \subset m$ shows that $V$ has dimension $2$. That's all. Thanks Harry. I think this is the case the localization of local ring at its maximal ideal is equal to itself."
91553,"I feel like you're looking for something like the following.  Galois covers of a topological space $X$ of degree $n$ correspond to homomorphisms $\pi_1X\to S_n$ where the image is transitive and has trivial point stabilizers. Arbitrary covers of degree $n$ correspond to homomorphisms $\pi_1X\to S_n$ where the image is just transitive.  No doubt this can be phrased in terms of something torsorish --- the answer should be approximately '$H^1(XY)$ where $Y$ is a transitive-but-not-necessarily-simply-transitive $G$-set'. That should have been 'Arbitrary *connected* covers of degree $n$...'  If you don't require connectedness you can also drop the transitivity assumption. There is a mistake in your statement.  The group $H^1(XG)$ is in bijective correspondence with homomorphisms $\pi_1(Xx)\to G$ up to conjugacy.  The kernel is a normal subgroup but the quotient need not equal $G$ -- only a subgroup of $G$."
