PostId,"GROUP_CONCAT(Text SEPARATOR ' ')"
89621,"You might take a look at Miles Reid's Bourbaki seminar
http://www.warwick.ac.uk/~masda/McKay/Bour/Bour.pdf
the book ""Orbifolds in Mathematics and Physics"" from 2001
and descriptions of results from the Newton Institute workshop
""Higher Dimensional Complex Geometry"" in 2002 which are available on
their website. There must be more recent summaries of results than these but I don't know where.
 Yes I have seen that they are written around the same time. Do you know what this has to do with physics? Physicists interested in String theory came up with this while studying strings on the resolved Calabi-Yau

See: L. Dixon J. Harvey C. Vafa and E. Witten Strings on orbifolds"
89622,"It happened by chance -- or better put by google. I had no idea he doesn't like being called Professor Schlump :) How did you happen across Schlumprecht's notes? (BTW: He HATES to be called ""Professor Schlump"".)"
89629,"The FRISCO project homepage http://www.nag.co.uk/projects/FRISCO.html has a ""final project report"" that may help."
89639,"Look up Cholesky decomposition You cannot estimate $A.$ Suppose $A$ is the Cholesky decomposition of $P$ which is easy to compute and numerically stable. Then given any orthogonal matrix $R$ meaning $R^T \; R = I$ then consider $B = R A.$ We get $$B^T \; B = (RA)^T \; R A = A^T \; R^T \; R \; A = A^T \; I \; A = P. $$ I apologize - the original question was formulated poorly.  The matrix A is symmetric as well. There can be many different looking symmetric matrices each of whose square is the identity matrix. The converse of Will's observation also holds: ie.  if $A$ is
nonsingular  and $P=A_1^TA_1=A_2^TA_2$ then $R=A_2A_1^{-1}=R^T$ is
orthogonal and $A_2=RA_1$. In this case if you think of the
Euclidean lattice generated by the columns of $A$ then $P=A^TA$ is
the Gram matrix (the quadratic form) and this just say that the Gram
matrix determines the lattice upto a rotation. But this does not
answer the question after finding $P=A^TA$ by Cholesky we know all
solutions are given by $RA R \in O(N)$ some  of the "
89644,"Is he the same person who also has a different(?) dissertation at South Carolina?(http://genealogy.math.ndsu.nodak.edu/id.php?id=1026) To save others the Googling trouble here's a link to the UNC library entry: http://search.lib.unc.edu/search?R=UNCb2492225 -- confusingly the author they have is Edward Bomback. Unfortunately they only have print access it seems.
 Unknown: No it's just a coincidence of names. Daniel: Can't you just borrow a paper copy from UNC's library via interlibrary loan? Jim an interesting coincidence."
89646,"$\varinjlim$ means direct limit and $\varprojlim$ means inverse limit. I think the following short exact sequence can be helpful.

$0\rightarrow a^n/b^n\rightarrow R/b^n\rightarrow R/b^n\rightarrow  0$ anna does this answers your problem? Anna what if you replace $R$ by an injective resolution take the exact sequence of complexes corresponding to the short exact sequence you mentioned and apply my comment above to the limit? are there any general theorems on what the limit $a^n/b^n$ should look like in a local ring? (I mean if you take an injective resolution for R then that thing becomes the dth cohomology of some complex. lim is exact (right?) so you might as well take the limit before computing cohomology. (just a shot in the dark) 0→an/bn→R/bn→R/an→0 I don't know if this is helpful but if you had $\mathfrak{a}=R$ then you are simply computing here (the cohomology of) $R\Gamma_{\mathfrak{b}} R$ which is just the infinite Koszul complex of $\mathfrak{b}$. It isn't helpful. Just so I understand when "
89650,"I think you meant to say ""*compact* absolutely convex sets"" above otherwise finding a counterexample is rather easy. Of course. I have corrected the question."
89651,"Take a look at Lefschetz' book ""Algebraic topology"" the beginning has a lot of detailed background on topological groups and Pontryagin duality. It's a little old fashioned but I found it very useful.

"
89658,"What you have called the incidence matrix is actually the adjacency matrix (as will be clear if you read the article you've linked to).

Your approach translates all coding theory questions into graph theory questions. It seems unlikely that much will be gained by the translation. Of course there are many papers studying the case when $A$ is sparse (LDPC codes). Chris Thank You I corrected ! Shame on me I am always mixing these matrices. Fields medalist G. Margulis constructed some ""good"" LDPC codes by Cayley graphs (???) of some groups GL(Fp) - as I heard but not really understand. There are lots of papers about ""expanders"" graphs which is probably related to this question... I just start learning these things so may be question is not really good..."
89659,"Ofcourse. I'm looking for the minimum cover. Although any other result could be useful as well. Do you have any restrictions on the kind of covering you want (minimum number of spaces say?) After all every single point of $F_q^n$ is an affine subspace."
89664,"Geoff. I agree that's part of what I tried to say. The issues are in quantum physicis (my field) most readers would not be familiar with character theory. Thus in a paper I prefer to work out these properties or to cite a clear reference. In this case this concept of ""orhogonal groups"" is very popular in Quantum Computation and has been used quite extensively in algorithm design for more than a decade. Therefore I am still interested on knowing what is the most common name for it in Math and on finding it somewhere on the standard literature. http://en.wikipedia.org/wiki/Character_theory#Orthogonality_relations What is $\chi_g$? Also you can write $+$ for the join since the groups are abelian and thus the join is just the sum of $\mathbb Z$-submodules. I clarified the notation for $\chi_g$ typically in our field one starts with a cyclic decomposition of $G$ and then the notation makes more sense. Is it clear now? Also I removed the join entirely since one can say the same thing using generating brackets which"
89668,"Linearization (“topological sort”) of a finite partial order given by a table can be computed in parallel in fact in uniform $TC^0$ by the following trivial procedure: put $x\prec y$ iff $|x\down|< |y\down|\lor(|x\down|=|y\down|\land x< y)$ where $x\down=\{z:z\unlhd x\}$ and $< $ is any fixed linear order. It follows that if $x\lhd_ay$ is a parametrized family of partial orders on $\{0\dotsa\}$ computable in polynomial-time (when given $xya$ in binary) then one can compute a uniform linearization $x\prec_ay$ in PP. However I don’t know how to make this work for infinite orders. Hmm read $\downarrow$ for $\down$. I have an answer only for some of the higher ""analogues"" at the moment.  Every PSPACE (or EXP) decidable partial order extends into a PSPACE (or EXP) decidable total order.  Reason: to decide whether $x\prec y$ one can safely ignore all $z\triangleleft w$ facts where $max(zw)>max(xy)$ (by transitivity of $\triangleleft$).  It is thus enough to construct partial linearizations starting with $0$ $"
89669,"Clarification :
My definition of the relation $\leq$ is as follows : let $\sigma\pi\in \mathcal{E}$ we pute $\sigma\leq\pi$ if $\sigma$ embeds in $\pi$.

 The article of Jaquet & Piateski-Chapiro & Shalika :

http://www.math.columbia.edu/~hj/conducteur.pdf I defined the set $L_{k}$ as follows : If $\pi$ is a generic irreducible representation of $GL(nF)$ the theorem of Jaquet & Piateski-Chapiro & Shalika says : there is a positive integer $k$ such that the representation $\pi$ admits a non zero vector fixed by the compact open subgroup $\Gamma_{k}$ defined by : $$\Gamma_{k}=\left(\begin{array}{cccc|c}
\mathcal{O}_{F}^{\times}&\mathcal{O}_{F}&\cdots&\mathcal{O}_{F}&\mathcal{O}_{F}{}\\
\mathcal{O}_{F}&\ddots&\ddots&\vdots&\vdots\\
\vdots&{}&\ddots&\mathcal{O}_{F}&\vdots{}\\
\mathcal{O}_{F}&\cdots&\mathcal{O}_{F}&\mathcal{O}_{F}^{\times}&\mathcal{O}_{F}{}\\
\hline
\mathcal{P}_{F}^{k}& \cdots & \cdots &\mathcal{P}_{F}^{k}&\mathcal{O}_{F}^{\times}\\
\end{array}\right)$$ I am not sure what $L_k$ is. So can you plea"
89670,"The Banach contraction mapping theorem only requires the space to be complete not compact. http://en.wikipedia.org/wiki/Banach_fixed-point_theorem. Clearly this set $K$ is not closed either. Consider g_n(t)=1/n I(0<t<n) then L_1 norm of g_n is 1 however this sequence does not converge to an element of $K$. Oleg: that $g_n$ is not Cauchy so it does not disprove $K$ closed.  In fact $K$ is closed (in the $L_1$ metric). So what? The sequence does not converge at all. Interpreting $g\ge 0$
as almost sure positivity the set $K$ is indeed closed and hence complete so that the fixed point theorem applies. I've voted to close as ""no longer relevant""-- it seems that Pablo already answered the question in his comment. To save the question the OP could ask for a ""weak contraction"" mapping with no fixed points $f:K\to K$ on the same set $K$ defined above but now only satisfying $\|f(x)-f(y)\| < \|x -y\|$ for all $x\neq y$ in $K$. (On a compact metric space $K$ such maps do have fixed points).  I took the liberty to edit "
89683,"See Hartshorne proof of Theorem III 7.11 - there he computes ${\scr E}xt^r(\mathcal{O}_{Y_1} \omega_X)$ by applying $Hom(- \Omega_X)$ to the Koszul complex of $\mathcal{O}_{Y_1}$. The Koszul complex exists only locally but then he shows that these local calculations glue together. I think you can apply the same argument to $\mathcal{O}_{Y_2}$ in place of $\omega_X$."
89684," Stéphane Laurent Could recommend some literature (papers) on this the conditional stochastic processes topic. Because all I can find is just short notes in textbooks and no deeper analysis. I would be greatfull for it.
 It is easy to extend: for each $t$ there is a conditional law of $X_t$ given $Y_t$. The formula $P(X_t=k\mid Y_t=i)=\pi_k(i)$ can be reformulated as $P(X_t=k\mid Y_t)=\pi_k(Y_t)$ and this formula makes perfectly good sense no matter what the distribution of $Y_t$. See http://en.wikipedia.org/wiki/Conditional_expectation#Formal_definition and http://en.wikipedia.org/wiki/Conditional_expectation#Definition_of_conditional_probability."
89688,"This number bears no significance in group theory.  If I remember correctly the following paper uses the Lefschetz fixed point theorem to decompose the homology representations of groups of finite automorphisms of surface groups into irreducibles: http://arxiv.org/abs/0905.3002 .  The same idea would work for free groups."
89692,"Every tree is a bipartite graph and the adjacency matrix is therefore of this form http://en.wikipedia.org/wiki/Adjacency_matrix#Adjacency_matrix_of_a_bipartite_graph 

 If a graph is a tree then its adjacency matrix can be written in the form $N + N^T$ where $N$ is nilpotent (pick a root and direct all the edges towards it).  The Smith Normal Form of the adjacency matrix must be $(1\dots10)$. All trees are bipartite. As the comments show many strange things can said about their adjacency matrices. Voting to close."
89693,"Are you sure you don't mean to understand the extensions of commutative group schemes *over* $k$ and not the extensions of $W(k)$-modules (after taking $k$-points)?  The former is described in Oort's book ""Commutative Group Schemes"" I think as well as Ch VII of Serre's ""Algebraic Groups and Class Fields.  The latter seems to depend heavily on the choice of field.
 The short exact sequence $0\to W\to W\to W_a\to 0$ where the map $W\to W$ is multiplication by $p^a$ is a projective resolution of $W_a$ over $W$. Applying $\mathrm{Hom}(- W_b)$ to this resolution we get that $\mathrm{Ext}_W(W_a W_b)$ is just $W_b/p^a W_b$. I do mean the extensions of $W(k)$-modules. Piotr Achinger: Thanks! That is the answer I am looking for!"
89695,"How is it measure-preserving for $\mathbb T$?  More generally for any Lie group $T_2$ increases Haar measure on small neighbourhoods of the identity.   Robert: to preserve measure means that $\lambda(T_2^{-1}(A))=\lambda(A)$ for all Borel $A$. This holds in the circle (and thus it's not a local property)."
89707,"It sounds like the examples have to occur for simple-homotopy reasons so my first guess would be 3-dimensional lens spaces would be fertile hunting grounds for examples you are interested in. "
89711,"Because a category is equivalent to the category of models of a coherent theory iff the category is coherent? I might be getting duped by terminology but I don't think I am. Andrej: No that doesn't seem to be the case. The theory of abelian groups is algebraic hence coherent but the category of abelian groups is not coherent (since coherent categories have a strict initial object while $\textbf{Ab}$ has a zero object). Isn't this question equivalent to asking whether the category of local rings and local ring homomorphisms is coherent as in http://ncatlab.org/nlab/show/coherent+category? Is it? I can't say I know enough about categorical algebra to see why this is plausible/implausible."
89720,"Well you're not in the Boston area so this won't be so helpful to you. But for others who find this thread and are near Boston I recommend MIT PRIMES (free year-long after school research mentoring program): http://web.mit.edu/primes/ Maybe this should be an answer but you could also look for non-MOers who have supervised high school students and email them directly; Pavel Etingof and Victor Ostrik come to mind... My thesis advisor Ken Ono has supervised high school students some of whom have done exceedingly well so I definitely intend to ask him personally for advice also."
89724,"I don't have a complete answer but one typically does not have a unique series expression without imposing additional constraints.  For example one may embed $K((XY))$ in either $K((X))((Y))$ or $K((Y))((X))$ by expanding quotients with one term order or another.  This yields different series expressions of $1/(X-Y)$. Yes you can assume an embedding. For every permutation on $m$ symbols you have an ordering of $\mathbb Z^m$ and you may assume that $K((XY))$ is contained in the field of functions from $\mathbb Z^m$ to $K$ with well-ordered support under this ordering. "
89735,"Thanks are to all of you. Intersection theory is really a good way to approach such kind of question. I am pretty sure that $\mathbb{P}^1 \times \mathbb{P}^1$ is the only case unfortunately though I don't have a reference or proof off hand. Note that the other rational ruled surfaces still admit certain ""large"" group actions for example they are all toric.  Surely an automorphism has to preserve the negative section no? So a point on that curve can not be moved away from it. (So yes P1xP1 is the only case)"
89738,"Two thoughts: (1) This isn't really real algebraic geometry; it's all about complex polynomials. Replace ""real part of $s$ less than zero"" by $s=-1$. Now your space is a $d$-fold cyclic cover of the complement of the projective hypersurface. (2) For calculating the dimension on the ""topological side"" can't you reduce to the diagonal case? The space of all nonsingular polynomials $s$ for a given $n$ and $d$ is connected and as $s$ varies this looks like a fiber bundle. "
89744,"Thanks for the tip Pascal! Pascal ^^ (in case the end of the sentence doesn't work) Thanks for the nice reference Pascal. I'm always a fan of Tsirelson's work. So a space of $\sigma$-algebras is fundamentally a distributive lattice but one needs to impose a probabilistic structure on top of that to have a meaningful continuous-type noise. Here's another Tsirelson paper on the topic:
http://projecteuclid.org/DPubS?service=UI&version=1.0&verb=Display&handle=euclid.ps/1104335300 About question 1: What do you mean by ""general structure"" ? As you said it is a filtration what kind of generalization of this do you expect ? Motivated by your question I have finally taken a look into B. Tsirelson Noise as a Boolean algebra of sigma-fields http://arxiv.org/abs/1111.7270  which has been lying on my desk for weeks :) I think that if there was a good answer to your question it would probably appear there. But as far as I understand the only ""general structure"" of $\mathbb F$ (or $\mathbb F_0$) that appears there is that o"
89746,"I don't think this is research level. You should maybe try math.stackexchange instead."
89747,"This is probably not a homework question.
 Actually there's something stronger true than what you say in the last line.  Namely if $R$ is *any* commutative ring $M$ is a finitely *presented* module and $N$ is *any* module then $Ass Hom_R(MN) = Supp M \cap Ass N$.  This is indeed well-known.  For instance it appears as an exercise in the book by Bruns and Herzog. It would be most helpful if you give some motivation and/or background. The way it phrased now makes it look like you want us to do your homework... You would really think about me."
89748,"To Jonny Evans: yes. I really intend to so. But on the other hand I want to learn the related subject systematically. I mean when I run into for example '3-manifold' I google it and know it is a topological concept. Although I can understand this concept quickly by google or wiki I still don't know the background of the concept and the idea behind it. So I think it is necessary to learn the related subject first... To Ryan Budney: yeah.. the book I got is written by Morgan-Tan..But I'm only new to Topology so cannot understand the proof now because I'm not familiar to some of the basic stuff...So I wonder with subject do I need to learn first? ToYemon Choi : I know something about topology... I think there's 7 or more books on the topic now.  There's Morgan-Tian.  There's Topping. There's Chow (2 different books). There's Cao-XiPing. And there's Kleiner.  Simon Brendle. Zhang.  On and on.  I've got a vague memory of a few others.  I think different approaches demand different backgrounds.  Some are more tradi"
89749,"I am certain that blow-up does occur (since we know there is no positive solution to the limit problem).  I tried rescaling and then using the fact that one knows the explicit solution of $ -\Delta v(x)= v(x)^p$ in $ R^N$ but the result this is giving me seems a bit weird... thanks.  Do you want some a priori estimate and then pass to the limit to prove the existence for the weak solution for the critical power $p=\frac{N+2}{N-2}$? For the variational approach of Yamabe problem or prescribing scalar curvature problem the strategy is to pass from the subcritical case to the critical case and to claim that blowing up can not happen in some sense."
89753,"I thought it was a cyclic thing not a simplicial one. Maybe I am mistaken though. A cyclic is simplicial by forgetful. what happens if you take the geometric realization of the simplicial set underlying $C_\bullet(AA)$?"
89756,"Bo: I added some backticks around some formulas; this is sometimes necessary since two programs try to process the sourcecode and the backticks prevent the first one (markdown) to do 'its job' where it should not (ie in ceratain formulas). In particular lessthan-signs and double backslashes tend to cause problems. Hope I did not mess up anything in the process.
Geoff Robinson: it was not diplayed due to a formatting problem.  Bo: sorry for the confusion due to some parallel edits. In case you reedit please check my version. I added only six backticks three pairs: around the big formula and the two formulas containing less than signs.  quid: Great thanks for your help! Geoff Robinson: now it works and thank you ! "
89759,"I don't quite see how your ""commutative square"" is a square. Could you explain your notation please? I am sorry; I would like to write $$S= \begin{CD} 
A>{}>> B \\
VV{}V
VV{}V \\
C>{}>>D
\end{CD}$$ but this doesn' seem to work. You need to include an image --- I am afraid that the TeX interpreter on the forum cannot parse commutative diagrams.  I can't read your comment. Some hints on how to include diagrams can be found here: http://meta.mathoverflow.net/discussion/871/introducing-diagrams-in-my-question/#Item_0 (I should say I haven't tried this yet myself). This seems to be too complicated. Actually I just mean a very basic commutative square with arrows from $A$ to $B and $C$ and from $B$ and $C$ to $D$. Fixed diagram using array (pro-tip: you have to use \newline instead of \\ to move to the next row). It's hard to say whether it addresses your question but you may try to take a look at Mather *Hurewicz Theorems for Pairs and Squares*. In K(Z-mod) (so not directly related to your question) Alberto Canona"
89761,"What does that mean ""isomorphic up to a finite dimensional representation"". Does it mean that there is a morphism from one 
representation to the other with finite dimensional kernel and cockerel? That can't be right because that there would be many trivial answers to your question like $\pi$ any infinite dimensional
representation (irreducible admissible) and $\pi'$ the trivial representation.   pm Joël perhaps ""up to a finite dimensional representation"" means the multiplicities of the $K$-types are different for only finitely many $K$-types. Of course there are going to be trivial counter-examples when the representations are not infinite-dimensional. Yes I am interested in infinite dimensional representations only."
89762,"For random gaussian matrices some experimental figures: $C_2 = 2.8409$ $C_3=2.4264$ $C_4=2.3061$ etc. that conjecture of mine is probably wrong because of numerical issues. For uniformly random matrices it seems $C_2 = 1.367$ $C_3=0.8188$ etc.; but since I cannot trust these results this brings up the question of how to reliably compute / estimate the numerical radius? One has ${\rm Tr}[AB]=0$. If $n=2$ we may apply to $[AB]$ the following formula valid whenever ${\rm Tr}M=0$ :
$$4r(M)^2=\|M\|_F^2+2|\det M|.$$"
89763,"Dinesh: I was referring to my own suggested approach not the whole plan. Why don't you take a sub-module $E^\prime$ of $E$ generated by a nonzero element of $E$? Since $E$ is torsion-free such an $E^\prime$ is isomorphic to $R$ so that $S^{-1}E^\prime\cong K$ and you can use induction using $E^\prime$ and $E/E^\prime$. Mahdi Majidi-Zolbanin So if we can prove $E/E'$ is torsion free with lesser generators than the minimal no.of generators of $E$ then we are done. Right? Dinesh: I think it suffices to show $E/E^\prime$ is torsion-free. You can choose the generator of $E^\prime$ to be one of the elements of a *minimal* set of generators of $E$. That way $E/E^\prime$ can be generated with one less than number of generators of $E$.  I think this approach is too naive and you don't get some torsion-free quotient for free ... I agree with Martin it wont work like this. Martin Brandenburg Can you please elaborate your comments? Is the whole plan naive? "
89771,"In principle I don't see a problem for Q1 although I can't really check what they do since my copy is not with me at the moment.
The answer to  Q2 is probably no. 
Although the Kummer sequence in the etale
topology is a sort of consolation prize."
89777,"Those unitary groups aren't they groups over $k$ itself? It seems to me that if $G$ is a unitary group for some hermitian form over some real quadratic extension of $\mathbb{Q}$ then it's a group over $\mathbb{Q}$ which is isomorphic to $\text{SL}_n$ over $\mathbb{R}$. Yves--You are correct. These would also be $\mathbb{Q}$-forms of $SL_{n\mathbb{R}}$. The only such forms are $SL_{m+1}(D)$ where $D$ is an indefinite division algebra over $\mathbb{Q}$ of degree $n/(m+1)$. So the question becomes: are there finitely many isomorphism classes of indefinite division algebras of fixed degree $d$? This is far from being true. Translating into Brauer groups you're essentially looking for elements of `\bigoplus_{p}\mathbb{Z}/d\mathbb{Z})` whose co-ordinates add up to $0$ and which have order exactly $d$.  Also if $\mathbb Q$ is replaced by a field $K$ with underfield $k$ with $[K:k]=2$ there are rational forms that are ""unitary groups"". And more complicated versions made from algebras with involutions of second kind. "
89779,"From context it seems you want `$D = sum X_i^2$` not just the sum as written; the latter would follow a normal distribution. Could you clarify? Yes I made a mistake originally but Douglas Zare fixed it. Thanks Douglas! This is something that I don't remember well from several courses in which it was touched on.  I'd start by googling ""Satterthwaite""."
89782,"I bet the answer is ""no"".  If I needed that notion I might say ""finite-groupoid cocomplete"" which is a bit clunky but transparent enough. I do recall however that Joyal considered somewhat similar cocompleteness conditions for analytic functors in the theory of species; see the appendix of his article in Springer LNM 1234.  This is a condition that pops up in the definition of Galois categories (at least with the additional assumption of an initial object). See Dubuc and de la Vega's paper ""On the Galois theory of Grothendieck"" http://arxiv.org/abs/math/0009145 - axiom G2 in section 4.1"
89784,"http://en.wikipedia.org/wiki/FKT_algorithm is polynomial time for *counting* perfect matchings in a planar graph.  Is this enough? I had found that article as well but I'm afraid I really need to have the different matchings. How big are the problems you care about?  Small cases can presumably be solved by brute force and large cases may have impossibly large numbers of matchings so the real question is whether you are somewhere in between. The goal is an exhaustive generation for small cases. I will need to go as far as possible so maybe a bit smarter than brute-force. Basically I'm just trying to explore whether something better than bruteforce is possible."
